name,expression_system,purity,endotoxin_level,sizes,prices,applications
Recombinant human TNF alpha protein (Active),HEK 293 cells,>=95% SDS-PAGE,< 0.005 EU/µg,10 µg,US$ 180.00,"SDS-PAGE, FuncS, MS, sELISA, Cell Culture, HPLC"
Recombinant human IL-1 beta protein (Active),HEK 293 cells,>95% SDS-PAGE,<= 0.005 EU/µg,10 µg,US$ 450.00,"sELISA, SDS-PAGE, FuncS, MS, HPLC, Cell Culture"
Recombinant human TNF alpha protein,Escherichia coli,>98% SDS-PAGE,< 1 EU/µg,10 µg,US$ 150.00,"SDS-PAGE, FuncS, HPLC, sELISA"
Streptavidin (HRP),Native,>95% SDS-PAGE,N/A,500 µg,US$ 180.00,"Dot, IM, ICC, ELISA, IHC-P, IHC-Fr, WB"
Recombinant mouse IL-1 beta protein (Active),HEK 293 cells,>=95% SDS-PAGE,<= 0.005 EU/µg,10 µg,US$ 450.00,"SDS-PAGE, FuncS, MS, HPLC, sELISA, Cell Culture"
Recombinant human HGF protein (Active),HEK 293 cells,>=95% SDS-PAGE,<= 0.005 EU/µg,10 µg,US$ 230.00,"SDS-PAGE, FuncS, MS, HPLC, Cell Culture"
Recombinant human GDNF protein (Active),HEK 293 cells,>=95% SDS-PAGE,<= 0.005 EU/µg,10 µg,US$ 205.00,"SDS-PAGE, FuncS, MS, HPLC, Cell Culture"
Recombinant Human IL-13 protein (Active),HEK 293 cells,>=95% SDS-PAGE,<= 0.005 EU/µg,10 µg,US$ 390.00,"SDS-PAGE, FuncS, MS, HPLC"
Recombinant Human Alpha-synuclein protein aggregate (Active),Escherichia coli,>95% SDS-PAGE,<= 20 EU/mL,N/A,N/A,"SDS-PAGE, FuncS, WB"
Recombinant rat IL-17A protein (Active),HEK 293 cells,>=95% SDS-PAGE,<= 0.005 EU/µg,10 µg,US$ 360.00,"SDS-PAGE, FuncS, MS, sELISA, HPLC, Cell Culture"
Recombinant mouse IL-3 protein (Active),HEK 293 cells,>=95% SDS-PAGE,<= 0.005 EU/µg,10 µg,US$ 275.00,"SDS-PAGE, FuncS, MS, HPLC, Cell Culture"
Recombinant human PLK1 protein,Baculovirus infected Sf9 cells,>70%,N/A,5 µg,US$ 385.00,"WB, FuncS, SDS-PAGE, IHC-P"
Recombinant Human VEGFC protein (Active),HEK 293 cells,>=95% HPLC,<= 0.005 EU/µg,10 µg,US$ 270.00,"SDS-PAGE, HPLC, Biological Activity"
Recombinant human CD47 protein (Fc Chimera Active),HEK 293 cells,>95% SDS-PAGE,< 1 EU/µg,N/A,N/A,"SDS-PAGE, FuncS, Flow Cyt"
Recombinant Human IL-33 protein (Active),HEK 293 cells,>95% SDS-PAGE,<= 0.005 EU/µg,10 µg,US$ 350.00,"FuncS, SDS-PAGE, MS, HPLC, Biological Activity, Cell Culture"
Recombinant human Growth Hormone protein (Active),HEK 293 cells,>=95% SDS-PAGE,<= 0.005 EU/µg,10 µg,US$ 185.00,"SDS-PAGE, FuncS, MS, sELISA, HPLC"
Native human alpha 1 Antitrypsin protein (Active),Native,>95% SDS-PAGE,N/A,N/A,N/A,"SDS-PAGE, WB, FuncS"
Recombinant Human Granzyme B Protein (His tag),HEK 293 cells,>=95% HPLC,<= 0.005 EU/µg,10 µg,US$ 295.00,"HPLC, MS, SDS-PAGE"
Recombinant Human Decorin protein (Active),HEK 293 cells,>95% SDS-PAGE,<= 0.005 EU/µg,10 µg,US$ 100.00,"SDS-PAGE, MS, HPLC, Biological Activity"
Recombinant human SynCAM/CADM1 protein,HEK 293 cells,>95% SDS-PAGE,< 1 EU/µg,N/A,N/A,"SDS-PAGE, ELISA, FuncS"
Recombinant human CaMKII delta protein,Baculovirus infected Sf9 cells,>85% Densitometry,N/A,5 µg,US$ 460.00,"SDS-PAGE, WB, FuncS"
Recombinant human CaMKII alpha protein,Baculovirus infected Sf9 cells,>80% Densitometry,N/A,5 µg,US$ 320.00,"SDS-PAGE, WB, FuncS"
Recombinant human Aurora B protein,Baculovirus infected Sf9 cells,>70% Densitometry,N/A,5 µg,US$ 385.00,"SDS-PAGE, WB, FuncS"
Recombinant human Alpha-Synuclein protein filament,Escherichia coli,>95% SDS-PAGE,< 0.1 EU/µg,N/A,N/A,"SDS-PAGE, FuncS, Dot, sELISA"
Recombinant HPV16 L1 protein,Saccharomyces cerevisiae,>90% SDS-PAGE,N/A,N/A,N/A,"SDS-PAGE, EM, WB"
Recombinant Human Alpha-synuclein (mutated A53T) protein aggregate Type 1 (Active),Escherichia coli,>95%,< 5 EU/mL,N/A,N/A,"FuncS, IHC-P, EM"
Recombinant human IL-22 protein (Active),HEK 293 cells,>=95% SDS-PAGE,<= 0.005 EU/µg,10 µg,US$ 350.00,"SDS-PAGE, FuncS, MS, HPLC, Cell Culture"
Recombinant human IL-1RA protein (Active),HEK 293 cells,>=95% HPLC,<= 0.005 EU/µg,10 µg,US$ 255.00,"SDS-PAGE, FuncS, MS, HPLC, Cell Culture"
Recombinant human IL-12 p70 protein (Active),HEK 293 cells,>=95% SDS-PAGE,< 0.005 EU/µg,10 µg,US$ 270.00,"SDS-PAGE, FuncS, MS, HPLC, Cell Culture"
Recombinant human IL-11 protein (Active),HEK 293 cells,>=95% SDS-PAGE,< 0.005 EU/µg,10 µg,US$ 240.00,"SDS-PAGE, FuncS, MS, HPLC, Cell Culture"
Recombinant Human Bim protein,Wheat germ,N/A,N/A,N/A,N/A,"SDS-PAGE, ELISA, WB"
Recombinant human Syk protein,Baculovirus infected Sf9 cells,>90% SDS-PAGE,N/A,5 µg,US$ 385.00,"SDS-PAGE, WB, FuncS"
Native Human Factor IX/PTC protein,Native,>95%,N/A,N/A,N/A,"SDS-PAGE, FuncS"
Recombinant human SCF protein (Active),HEK 293 cells,>=95% SDS-PAGE,<= 0.005 EU/µg,10 µg,US$ 385.00,"SDS-PAGE, FuncS, MS, Cell Culture, HPLC"
Recombinant human SIRP alpha protein (Fc Chimera Active),HEK 293 cells,>95% SDS-PAGE,< 1 EU/µg,N/A,N/A,"SDS-PAGE, FuncS, HPLC"
Recombinant human Tau (mutated P301S) protein monomer (Active),Escherichia coli,>95%,N/A,N/A,N/A,"SDS-PAGE, FuncS"
Recombinant Human TREM2 protein,HEK 293 cells,HPLC,<= 0.005 EU/µg,10 µg,US$ 195.00,"SDS-PAGE, MS, HPLC"
Recombinant human Cyclophilin A protein (Active),Escherichia coli,>95% SDS-PAGE,< 1 EU/µg,100 µg,US$ 325.00,"SDS-PAGE, FuncS"
Recombinant human CXCL10/IP10 protein (Active),HEK 293 cells,>=95% SDS-PAGE,<= 0.005 EU/µg,50 µg,US$ 400.00,"SDS-PAGE, FuncS, MS, HPLC"
Native Staphylococcus aureus Protein A (HRP),Native,>95% SDS-PAGE,N/A,N/A,N/A,"Dot, IM, WB, ELISA, IHC-P"
Native Diphtheria Toxin (mutated G52E) protein,Native,>95% SDS-PAGE,N/A,N/A,N/A,"SDS-PAGE, ELISA, WB, FuncS"
EGFP protein (His tag),Escherichia coli,>=97% SDS-PAGE,< 1 EU/µg,100 µg,US$ 435.00,"SDS-PAGE, WB, Conjugation"
Recombinant human CDK1 + Cyclin-A1 protein,Baculovirus infected Sf9 cells,>75% Densitometry,N/A,5 µg,US$ 450.00,"SDS-PAGE, WB, FuncS"
Recombinant Human p53 protein,Escherichia coli,>90% SDS-PAGE,N/A,N/A,N/A,"SDS-PAGE, MS"
Recombinant mouse PCSK9 protein,HEK 293 cells,>97% SDS-PAGE,< 1 EU/µg,N/A,N/A,"ELISA, SDS-PAGE, FuncS"
Recombinant AMARV GP protein (His tag),Baculovirus infected Sf9 cells,>70% SDS-PAGE,N/A,N/A,N/A,"ELISA, WB, SDS-PAGE"
Recombinant Treponema pallidum p47 protein,Escherichia coli,>90% SDS-PAGE,N/A,N/A,N/A,"ELISA, WB"
Recombinant Human CD2 protein (His tag) (Active),HEK 293 cells,>=95% HPLC,<= 0.005 EU/µg,10 µg,US$ 200.00,"HPLC, MS, SDS-PAGE"
Recombinant human CDC7 + DBF4 protein,Baculovirus infected Sf9 cells,>85% Densitometry,N/A,5 µg,US$ 450.00,"SDS-PAGE, WB, FuncS"
Recombinant human CDK1 + CCNB1 protein (Tagged),Baculovirus infected Sf9 cells,>75% Densitometry,N/A,N/A,N/A,"SDS-PAGE, WB, FuncS"
Recombinant human Eph receptor B4/HTK protein,Baculovirus infected Sf9 cells,>95% Densitometry,N/A,5 µg,US$ 460.00,"SDS-PAGE, WB, FuncS"
Recombinant human Eph receptor B4/HTK protein,Baculovirus infected Sf9 cells,>95% SDS-PAGE,N/A,5 µg,US$ 370.00,"SDS-PAGE, WB, FuncS"
Recombinant human Eph receptor A4/SEK protein,Baculovirus infected Sf9 cells,>90% SDS-PAGE,N/A,5 µg,US$ 450.00,"SDS-PAGE, WB, FuncS"
Recombinant human CD167a/DDR1 protein,Baculovirus,>90% SDS-PAGE,N/A,N/A,N/A,"SDS-PAGE, WB, FuncS"
Recombinant human Eph receptor A3 protein,Baculovirus infected Sf9 cells,>90% SDS-PAGE,N/A,5 µg,US$ 450.00,"SDS-PAGE, WB, FuncS"
Recombinant Human IL-4R Protein (Active),HEK 293 cells,>=95% HPLC,<= 0.005 EU/µg,10 µg,US$ 295.00,"SDS-PAGE, MS, HPLC"
Recombinant Human IL-5 protein (Active),HEK 293 cells,>=95% SDS-PAGE,<= 0.005 EU/µg,10 µg,US$ 375.00,"SDS-PAGE, FuncS, MS, HPLC"
Recombinant Human IL-17F protein (Active),HEK 293 cells,>=95% SDS-PAGE,<= 0.005 EU/µg,10 µg,US$ 245.00,"SDS-PAGE, MS, HPLC, Biological Activity"
Recombinant Human IL1R1 Protein (Active),HEK 293 cells,>=95% HPLC,<= 0.005 EU/µg,10 µg,US$ 140.00,N/A
Recombinant human Nectin 2 protein (Active),HEK 293 cells,>95% SDS-PAGE,< 0.1 EU/µg,100 µg,US$ 840.00,"FuncS, ELISA, SDS-PAGE"
Recombinant human NEK3 protein,Baculovirus infected Sf9 cells,>80% Densitometry,N/A,5 µg,US$ 460.00,"SDS-PAGE, WB, FuncS"
Recombinant human NEK11 protein,Baculovirus infected Sf9 cells,>90% SDS-PAGE,N/A,5 µg,US$ 365.00,"SDS-PAGE, WB, FuncS"
Recombinant Human Prostate Specific Antigen protein,HEK 293 cells,>=95% HPLC,<= 0.005 EU/µg,10 µg,US$ 360.00,"SDS-PAGE, MS, HPLC"
Recombinant human Ret (mutated V804L) protein,Baculovirus infected Sf9 cells,>95% Densitometry,N/A,5 µg,US$ 370.00,"SDS-PAGE, WB, FuncS"
Recombinant Human MUC2 Protein Standard (His tag),HEK 293 cells,>=80% SDS-PAGE,N/A,N/A,N/A,"SDS-PAGE, sELISA"
Recombinant human PPM1G protein,Baculovirus infected Sf9 cells,>95% SDS-PAGE,N/A,5 µg,US$ 370.00,"SDS-PAGE, WB, FuncS"
Recombinant human TYK2 protein,Baculovirus infected Sf9 cells,>70% Densitometry,N/A,5 µg,US$ 365.00,"SDS-PAGE, WB, FuncS"
Recombinant human Rad51 protein (Active),Escherichia coli,>95% SDS-PAGE,N/A,N/A,N/A,"SDS-PAGE, WB, FuncS"
Recombinant Human TNFRSF1A Protein (Active),HEK 293 cells,>=95% SDS-PAGE,<= 0.005 EU/µg,10 µg,US$ 205.00,"SDS-PAGE, MS, Biological Activity, HPLC"
Recombinant mouse Leptin protein (Active),HEK 293 cells,>=95% SDS-PAGE,<= 0.005 EU/µg,10 µg,US$ 245.00,"SDS-PAGE, FuncS, MS, HPLC"
Recombinant human TRAIL protein,Escherichia coli,>=99% SDS-PAGE,<= 0.04 EU/µg,N/A,N/A,"SDS-PAGE, FuncS"
Recombinant human TNIK protein,Baculovirus infected Sf9 cells,>95% SDS-PAGE,N/A,N/A,N/A,"SDS-PAGE, WB, FuncS"
Recombinant Mouse IL-7 protein (Active),HEK 293 cells,>95% SDS-PAGE,N/A,10 µg,US$ 395.00,"SDS-PAGE, FuncS, MS, HPLC"
Recombinant Mouse NEK1 protein,Baculovirus infected Sf9 cells,>70% Densitometry,N/A,N/A,N/A,"SDS-PAGE, WB, FuncS"
Recombinant mouse JNK3 protein,Baculovirus infected Sf9 cells,>80% SDS-PAGE,N/A,N/A,N/A,"SDS-PAGE, WB, FuncS"
Recombinant HIV1 p24 protein,Escherichia coli,>95% SDS-PAGE,N/A,N/A,N/A,"ELISA, WB"
Native Human Collagen IV protein,Native,>95%,N/A,N/A,N/A,"ELISA, IP, BL, WB, SDS-PAGE"
AGE-BSA,Native,>98% SDS-PAGE,N/A,N/A,N/A,SDS-PAGE
Recombinant Western Equine Encephalitis Virus E3E2 protein (His tag),HEK 293T cells,>80% SDS-PAGE,N/A,N/A,N/A,"SDS-PAGE, ELISA, WB"
Recombinant Human ACE2 (mutated H374N + H378N) protein (Fc Chimera),HEK 293 cells,>95%,< 1 EU/mg,N/A,N/A,"SDS-PAGE, ELISA, HPLC"
Recombinant human AKT1 protein,Baculovirus infected Sf9 cells,>70% SDS-PAGE,N/A,N/A,N/A,"SDS-PAGE, WB, FuncS"
Recombinant human AKT2 protein,Baculovirus infected Sf9 cells,>90% SDS-PAGE,N/A,N/A,N/A,"SDS-PAGE, WB, FuncS"
Recombinant pig GM-CSF protein (Active),Escherichia coli,>=95% SDS-PAGE,<= 1 EU/µg,5 µg,US$ 160.00,"SDS-PAGE, FuncS"
Recombinant HPV16 E6 protein (His tag),Escherichia coli,>90% SDS-PAGE,N/A,N/A,N/A,"SDS-PAGE, MS"
Recombinant mouse TRAP/CD40L protein (Active),HEK 293 cells,>95% SDS-PAGE,< 1 EU/µg,N/A,N/A,"SDS-PAGE, FuncS, ELISA, HPLC"
Recombinant Human Carbonic Anhydrase 9 / CA9 Protein (Active),HEK 293 cells,>=95% HPLC,<= 0.005 EU/µg,10 µg,US$ 315.00,"HPLC, MS, SDS-PAGE"
Recombinant Mycobacterium tuberculosis Ag85B protein,Escherichia coli,>90% SDS-PAGE,N/A,N/A,N/A,SDS-PAGE
Recombinant mouse Hsp60 protein,Escherichia coli,>90% SDS-PAGE,N/A,N/A,N/A,"SDS-PAGE, WB, FuncS"
Recombinant Human FGL1 protein (Fc Chimera),HEK 293 cells,>=95% HPLC,<= 0.005 EU/µg,10 µg,US$ 185.00,"HPLC, MS, SDS-PAGE"
Recombinant human CamKII gamma protein,Wheat germ,>99%,N/A,2 µg,US$ 740.00,"SDS-PAGE, ELISA, WB, FuncS"
Recombinant human Cathepsin K protein (Active),Baculovirus infected insect cells,>95% SDS-PAGE,N/A,N/A,N/A,"SDS-PAGE, FuncS"
Recombinant Human DR5 Protein (Active),HEK 293 cells,>=95% HPLC,<= 0.005 EU/µg,10 µg,US$ 140.00,"HPLC, MS, SDS-PAGE"
Recombinant human ERK1 protein,Escherichia coli,>90% Densitometry,N/A,5 µg,US$ 450.00,"WB, FuncS"
Recombinant human CaMKII beta protein,Wheat germ,>99%,N/A,N/A,N/A,"SDS-PAGE, ELISA, WB, FuncS"
Recombinant Human MIP-1 alpha/CCL3 protein (Active),HEK 293 cells,>=95% SDS-PAGE,<= 0.005 EU/µg,10 µg,US$ 250.00,"SDS-PAGE, MS, HPLC"
Recombinant Human MICB Protein (His-tag) (Active),HEK 293 cells,>=95% HPLC,<= 0.005 EU/µg,10 µg,US$ 200.00,"HPLC, SDS-PAGE, MS"
Recombinant human MLK3 protein,Baculovirus infected Sf9 cells,>75% Densitometry,N/A,5 µg,US$ 365.00,"SDS-PAGE, WB, FuncS"
Recombinant human DPP8 protein,Baculovirus infected Sf9 cells,>80% SDS-PAGE,N/A,N/A,N/A,"SDS-PAGE, WB, FuncS"
Recombinant Human MMP9 protein (Proenzyme),Escherichia coli,>95% SDS-PAGE,N/A,N/A,N/A,"SDS-PAGE, ELISA, WB"
Recombinant Human Procalcitonin protein,Escherichia coli,>95% SDS-PAGE,< 1 EU/µg,10 µg,US$ 300.00,"SDS-PAGE, HPLC, WB"
Recombinant human RIP protein (Active),Baculovirus infected Sf9 cells,>70% Densitometry,N/A,5 µg,US$ 740.00,"WB, FuncS"
Recombinant Human TRAP/CD40L Protein (Active),HEK 293 cells,HPLC,<= 0.005 EU/µg,10 µg,US$ 260.00,"SDS-PAGE, MS, HPLC"
Recombinant human PPP1A/PPP1CA protein,Baculovirus infected Sf9 cells,>75% Densitometry,N/A,5 µg,US$ 365.00,"WB, Phosphatase Activity"
Recombinant Human TNFAIP3 Protein,HEK 293 cells,>=95% HPLC,<= 0.005 EU/µg,10 µg,US$ 275.00,"HPLC, MS, SDS-PAGE"
Recombinant Human TNF Receptor II Protein (Active),HEK 293 cells,>=95% HPLC,<= 0.005 EU/µg,10 µg,US$ 255.00,"HPLC, MS, SDS-PAGE"
Recombinant Rat IL-13 Protein (Active),HEK 293 cells,>=95% HPLC,<= 0.005 EU/µg,10 µg,US$ 200.00,"HPLC, MS, SDS-PAGE"
Recombinant Human PVRL1/NECTIN1 protein (Tagged),HEK 293 cells,>=81% SDS-PAGE,N/A,N/A,N/A,"SDS-PAGE, WB, Size Exclusion Chromatography"
Recombinant Rat IL-1 alpha Protein (Active),HEK 293 cells,>=95% HPLC,<= 0.005 EU/µg,10 µg,US$ 295.00,"HPLC, MS, SDS-PAGE"
Recombinant human TrkC protein,Baculovirus infected Sf9 cells,>80% Densitometry,N/A,N/A,N/A,"WB, FuncS"
Recombinant rat IL-15 protein,Escherichia coli,>95% SDS-PAGE,N/A,2 µg,US$ 150.00,"SDS-PAGE, FuncS"
Recombinant Human MYL9 protein,Escherichia coli,>90% SDS-PAGE,N/A,50 µg,US$ 360.00,"SDS-PAGE, MS, WB"
Recombinant Human GAPDH protein,Escherichia coli,>95% SDS-PAGE,N/A,100 µg,US$ 350.00,SDS-PAGE
Recombinant human TGF beta 2 protein (Active),HEK 293 cells,>98% SDS-PAGE,< 1 EU/µg,2 µg,US$ 175.00,"SDS-PAGE, HPLC, WB, FuncS"
Recombinant rat BVR protein,Escherichia coli,>95% SDS-PAGE,N/A,N/A,N/A,"SDS-PAGE, WB, FuncS"
Recombinant human BTK protein,Baculovirus infected Sf9 cells,>75% Densitometry,N/A,5 µg,US$ 485.00,"SDS-PAGE, FuncS"
Recombinant Human FEN1 protein,Escherichia coli,>90% SDS-PAGE,N/A,N/A,N/A,"SDS-PAGE, MS, WB"
Recombinant human BRAF (mutated V600E) protein (Active),Baculovirus infected Sf9 cells,>85% Densitometry,N/A,5 µg,US$ 385.00,"SDS-PAGE, FuncS"
Recombinant human Brk/PTK6 protein,Baculovirus infected Sf9 cells,>90% SDS-PAGE,N/A,N/A,N/A,"SDS-PAGE, FuncS"
Recombinant human Interferon alpha 1 protein (Active),Escherichia coli,>95% SDS-PAGE,< 1 EU/µg,100 µg,US$ 370.00,"SDS-PAGE, sELISA"
Recombinant Human LECT2 protein,Escherichia coli,>95% Densitometry,< 0.1 EU/µg,N/A,N/A,"SDS-PAGE, ELISA, WB, MS"
Recombinant human BLK protein,Baculovirus infected Sf9 cells,>90% Densitometry,N/A,N/A,N/A,"SDS-PAGE, FuncS"
Recombinant human IRAK-1 protein,Insect cells,>85% SDS-PAGE,N/A,N/A,N/A,"SDS-PAGE, FuncS, WB"
Recombinant Human Smad4 protein,Escherichia coli,>90% SDS-PAGE,N/A,100 µg,US$ 290.00,"SDS-PAGE, WB, EMSA"
Recombinant human SIRT5 protein,Baculovirus,>80% SDS-PAGE,N/A,5 µg,US$ 450.00,"SDS-PAGE, FuncS"
Recombinant human SIRT1 protein,Baculovirus infected Sf9 cells,>70% Densitometry,N/A,5 µg,US$ 450.00,"SDS-PAGE, FuncS"
Recombinant human IL-2 protein,Escherichia coli,>98% SDS-PAGE,N/A,N/A,N/A,"SDS-PAGE, HPLC, ELISA, WB, FuncS"
Recombinant Human S100A9 protein,Escherichia coli,>90% SDS-PAGE,N/A,100 µg,US$ 320.00,"SDS-PAGE, MS, WB"
Native human Thrombin protein (Active),Native,>95% SDS-PAGE,N/A,N/A,N/A,"SDS-PAGE, FuncS"
Native human Plasmin protein (Active),Native,>=95% SDS-PAGE,N/A,N/A,N/A,"SDS-PAGE, FuncS"
Native Human IgM Fc fragment protein,Native,>95% SDS-PAGE,N/A,N/A,N/A,SDS-PAGE
Recombinant Human Adiponectin protein,HEK 293 cells,>=95% HPLC,<= 0.005 EU/µg,10 µg,US$ 95.00,"SDS-PAGE, MS, HPLC"
Recombinant human AKT1 protein,Baculovirus infected Sf9 cells,>90% Densitometry,N/A,5 µg,US$ 345.00,"SDS-PAGE, FuncS"
Native Human Collagen V protein,Native,N/A,N/A,N/A,N/A,"IP, WB, ELISA, SDS-PAGE"
Recombinant human ABL1 (mutated Y253F) protein,Baculovirus infected Sf9 cells,>80% Densitometry,N/A,5 µg,US$ 365.00,"SDS-PAGE, WB, FuncS"
Recombinant human ABL1 (mutated V299L) protein,Baculovirus infected Sf9 cells,>70% Densitometry,N/A,5 µg,US$ 385.00,"SDS-PAGE, FuncS"
Recombinant human c-Kit (mutated V559D + V654A) protein,Baculovirus infected Sf9 cells,>70% SDS-PAGE,N/A,5 µg,US$ 545.00,"SDS-PAGE, FuncS"
Recombinant human c-Kit (mutated V559D + T670I) protein,Baculovirus infected Sf9 cells,>70% Densitometry,N/A,5 µg,US$ 545.00,"SDS-PAGE, FuncS"
Recombinant human c-Kit (mutated N822K) protein (Active),Baculovirus infected Sf9 cells,>85% SDS-PAGE,N/A,5 µg,US$ 545.00,"SDS-PAGE, FuncS"
Recombinant Human CD22 protein,HEK 293 cells,HPLC,<= 0.005 EU/µg,10 µg,US$ 185.00,"SDS-PAGE, HPLC, MS"
Recombinant human c-Kit (mutated D820E) protein,Baculovirus infected Sf9 cells,>85% Densitometry,N/A,5 µg,US$ 545.00,"SDS-PAGE, FuncS"
Recombinant Human CD134 / OX40L receptor Protein (His-tag) (Active),HEK 293 cells,>=95% HPLC,<= 0.005 EU/µg,10 µg,US$ 185.00,"FuncS, HPLC, SDS-PAGE"
Recombinant Human CXCL1/GRO alpha protein,HEK 293 cells,>=95% HPLC,<= 0.005 EU/µg,10 µg,US$ 245.00,"SDS-PAGE, MS, HPLC"
Recombinant human CD2 protein (Active),HEK 293 cells,>95% SDS-PAGE,< 1 EU/µg,N/A,N/A,"SDS-PAGE, FuncS"
Recombinant Human CD14 protein,HEK 293 cells,>=95% SDS-PAGE,<= 0.005 EU/µg,N/A,N/A,"SDS-PAGE, MS, HPLC"
Recombinant Human CTHRC1 protein,HEK 293 cells,>95% SDS-PAGE,< 1 EU/µg,N/A,N/A,"SDS-PAGE, WB, MS, FuncS"
Recombinant human ErbB2 / HER2 (mutated G776V + G776C) protein (Cytoplasmic domain),Baculovirus infected Sf9 cells,>75% SDS-PAGE,N/A,5 µg,US$ 550.00,"SDS-PAGE, FuncS"
Recombinant Human CX3CR1 protein,Wheat germ,N/A,N/A,N/A,N/A,"SDS-PAGE, ELISA, WB"
Recombinant human Eph receptor B3 protein,Baculovirus infected Sf9 cells,>90% Densitometry,N/A,5 µg,US$ 385.00,"SDS-PAGE, FuncS"
Recombinant human CSNK2A1 protein,Baculovirus infected Sf9 cells,>95% SDS-PAGE,N/A,N/A,N/A,"SDS-PAGE, FuncS"
Recombinant Human Eotaxin protein,HEK 293 cells,>95% SDS-PAGE,<= 0.005 EU/µg,10 µg,US$ 290.00,"SDS-PAGE, MS, HPLC"
Recombinant Human Glypican 3 Protein,HEK 293 cells,>=95% HPLC,<= 0.005 EU/µg,10 µg,US$ 205.00,"HPLC, MS, SDS-PAGE"
Recombinant human Eph receptor B2 protein,Baculovirus infected Sf9 cells,>90% Densitometry,N/A,5 µg,US$ 320.00,"SDS-PAGE, FuncS"
Recombinant Human GDNF Protein,HEK 293 cells,>=0.95% HPLC,<= 0.005 EU/µg,10 µg,US$ 320.00,"MS, HPLC, SDS-PAGE"
Recombinant Human Glutamine Synthetase protein,Escherichia coli,>90% SDS-PAGE,N/A,100 µg,US$ 360.00,"SDS-PAGE, MS, WB"
Recombinant human GAPDH protein (Active),Escherichia coli,>95% SDS-PAGE,N/A,10 µg,US$ 110.00,"SDS-PAGE, FuncS"
Recombinant human Hsp70 protein,Baculovirus infected Sf9 cells,>90% SDS-PAGE,N/A,25 µg,US$ 365.00,"SDS-PAGE, ELISA, WB, FuncS"
Recombinant Human Hsp60 protein,Escherichia coli,>90% SDS-PAGE,< 50 EU/mg,N/A,N/A,"SDS-PAGE, WB, FuncS"
Recombinant human KDS protein,Baculovirus infected Sf9 cells,>90% SDS-PAGE,N/A,5 µg,US$ 365.00,"SDS-PAGE, WB, FuncS"
Recombinant human ITK/EMT protein (Active),Baculovirus infected Sf9 cells,>80% Densitometry,N/A,5 µg,US$ 385.00,"SDS-PAGE, FuncS"
Recombinant Human HSF1 (phospho ) protein,Escherichia coli,>90% SDS-PAGE,N/A,N/A,N/A,"SDS-PAGE, WB"
Recombinant human IRE1b protein,Baculovirus infected Sf9 cells,>95% SDS-PAGE,N/A,5 µg,US$ 385.00,"SDS-PAGE, FuncS"
Recombinant human Met (c-Met) (mutated D1228N) protein,Baculovirus infected Sf9 cells,>95% Densitometry,N/A,5 µg,US$ 375.00,"SDS-PAGE, FuncS"
Recombinant human MERTK protein,Baculovirus infected Sf9 cells,>90% Densitometry,N/A,5 µg,US$ 385.00,"SDS-PAGE, FuncS"
Recombinant human ITK/EMT protein,Baculovirus infected Sf9 cells,>90% Densitometry,N/A,N/A,N/A,"SDS-PAGE, FuncS"
Recombinant human MERTK (mutated A708S) protein,Baculovirus infected Sf9 cells,>95% Densitometry,N/A,5 µg,US$ 370.00,"SDS-PAGE, WB, FuncS"
Recombinant human MELK protein (Active),Baculovirus infected Sf9 cells,>85% Densitometry,N/A,5 µg,US$ 550.00,"SDS-PAGE, FuncS"
Recombinant human NEK8 protein,Baculovirus infected Sf9 cells,>75% SDS-PAGE,N/A,5 µg,US$ 385.00,"SDS-PAGE, FuncS"
Recombinant Human Nuclear respiratory factor 2 protein (His tag),Escherichia coli,>90% SDS-PAGE,N/A,N/A,N/A,"SDS-PAGE, ELISA, WB, MS"
Recombinant human NLK protein,Baculovirus infected Sf9 cells,>85% SDS-PAGE,N/A,N/A,N/A,"SDS-PAGE, WB, FuncS"
Recombinant human PFTK1 (CDK14)/CyclinY protein,Baculovirus infected Sf9 cells,>90% Densitometry,N/A,5 µg,US$ 420.00,"SDS-PAGE, FuncS"
Recombinant Human PEDF protein,HEK 293 cells,HPLC,<= 0.005 EU/µg,10 µg,US$ 260.00,"SDS-PAGE, MS, HPLC"
Recombinant human NEK6 protein,Baculovirus infected Sf9 cells,>90% SDS-PAGE,N/A,N/A,N/A,"SDS-PAGE, FuncS"
Recombinant human PDGFR beta protein,Baculovirus infected Sf9 cells,>90% SDS-PAGE,N/A,5 µg,US$ 385.00,"SDS-PAGE, FuncS"
Recombinant human PDGFR alpha (mutated T674I) protein,Baculovirus infected Sf9 cells,>80% SDS-PAGE,N/A,N/A,N/A,"SDS-PAGE, WB, FuncS"
Recombinant Human PPIH protein,Escherichia coli,>95% SDS-PAGE,< 1 EU/µg,N/A,N/A,"SDS-PAGE, ELISA, WB, MS"
Recombinant Human PPP3CA + PPP3R1 protein,Escherichia coli,>90% SDS-PAGE,N/A,N/A,N/A,"SDS-PAGE, ELISA, WB, MS"
Recombinant human PPIL1 protein,Escherichia coli,>95% SDS-PAGE,N/A,N/A,N/A,"SDS-PAGE, WB, FuncS"
Recombinant human RON protein,Baculovirus infected Sf9 cells,>85% Densitometry,N/A,5 µg,US$ 385.00,"SDS-PAGE, FuncS"
Recombinant Human PON1 protein - BSA and Azide free,Escherichia coli,>90% Densitometry,< 1 EU/µg,N/A,N/A,"SDS-PAGE, ELISA, WB, MS"
Recombinant human ROCK2 protein,Baculovirus infected Sf9 cells,>95% Densitometry,N/A,5 µg,US$ 370.00,"SDS-PAGE, WB, FuncS"
Recombinant human ROCK1 protein,Baculovirus infected Sf9 cells,>90% Densitometry,N/A,5 µg,US$ 350.00,"SDS-PAGE, FuncS"
Recombinant Human Siglec 9 Protein (Fc-tag),HEK 293 cells,>=95% HPLC,<= 0.005 EU/µg,10 µg,US$ 200.00,"HPLC, SDS-PAGE, MS"
Recombinant Human Siglec 7 Protein (Fc-tag),HEK 293 cells,>=95% HPLC,<= 0.005 EU/µg,10 µg,US$ 200.00,"HPLC, SDS-PAGE, MS"
Recombinant human SIRT2 protein,Baculovirus,>70% Densitometry,N/A,5 µg,US$ 450.00,"SDS-PAGE, FuncS"
Recombinant human SIK1 protein,Baculovirus infected Sf9 cells,>90% Densitometry,N/A,5 µg,US$ 350.00,"SDS-PAGE, FuncS"
Recombinant human RIP2 protein,Baculovirus infected Sf9 cells,>90% Densitometry,N/A,N/A,N/A,"SDS-PAGE, FuncS"
Recombinant Human TFIIB protein,Escherichia coli,>95% SDS-PAGE,N/A,N/A,N/A,"SDS-PAGE, GSA, WB, EMSA"
Recombinant Human TFIIE alpha/GTF2E1 protein (His tag),Escherichia coli,>70%,N/A,N/A,N/A,"SDS-PAGE, WB, MS"
Recombinant Human TCEAL2 protein (His tag),Escherichia coli,>70% SDS-PAGE,N/A,N/A,N/A,"SDS-PAGE, WB, MS"
Recombinant Human WFDC2 Protein (His tag) (E.Coli),Escherichia coli,>=95% HPLC,<= 0.1 EU/mg,10 µg,US$ 105.00,"HPLC, SDS-PAGE, MS"
Recombinant Human Tau (phospho ) protein,Escherichia coli,>85% SDS-PAGE,N/A,N/A,N/A,SDS-PAGE
Recombinant human VRK2 protein,Baculovirus infected Sf9 cells,>90% SDS-PAGE,N/A,5 µg,US$ 450.00,"SDS-PAGE, FuncS"
Recombinant Mouse Macrophage Inflammatory Protein 3 alpha,HEK 293 cells,>=95% HPLC,<= 0.005 EU/µg,10 µg,US$ 215.00,"SDS-PAGE, MS, HPLC"
Recombinant Mouse LIF protein (Active),HEK 293 cells,>=95% SDS-PAGE,<= 0.005 EU/µg,10 µg,US$ 230.00,"SDS-PAGE, FuncS, MS"
Recombinant human VEGFA protein (Active),Escherichia coli,>95% SDS-PAGE,< 1 EU/µg,N/A,N/A,"SDS-PAGE, FuncS, MS"
Recombinant Mouse Klotho protein,HEK 293 cells,>=95% HPLC,<= 0.005 EU/µg,10 µg,US$ 165.00,"HPLC, MS, SDS-PAGE"
Recombinant Mouse IGF2 Protein,HEK 293 cells,>=95% HPLC,<= 0.005 EU/µg,10 µg,US$ 85.00,"MS, SDS-PAGE, HPLC"
Recombinant Human VE Cadherin protein,Wheat germ,N/A,N/A,N/A,N/A,"SDS-PAGE, ELISA, PepArr, WB"
Recombinant rhesus monkey PCSK9 protein (Active),HEK 293 cells,>95% SDS-PAGE,< 1 EU/µg,N/A,N/A,"FuncS, ELISA, SDS-PAGE"
Recombinant Streptavidin protein (HRP),Escherichia coli,>90% SDS-PAGE,N/A,N/A,N/A,"ELISA, WB"
Recombinant Streptavidin protein,Escherichia coli,>95% SDS-PAGE,N/A,N/A,N/A,SDS-PAGE
Recombinant Human coronavirus SARS-CoV-2 Spike Glycoprotein S1 (Fc Chimera),HEK 293 cells,>95%,< 1 EU/mL,100 µg,US$ 710.00,"SDS-PAGE, I-ELISA"
Recombinant rhesus monkey CD4 protein (Fc Chimera Active),HEK 293 cells,>95% SDS-PAGE,< 1 EU/µg,N/A,N/A,SDS-PAGE
Recombinant Human CBR4 protein,Escherichia coli,>95% SDS-PAGE,N/A,50 µg,US$ 450.00,"SDS-PAGE, WB, MS"
Recombinant Human DOPA Decarboxylase/DDC protein,Escherichia coli,>95% SDS-PAGE,< 1 EU/µg,N/A,N/A,SDS-PAGE
Recombinant Human Dopamine Transporter protein,Wheat germ,N/A,N/A,N/A,N/A,"SDS-PAGE, ELISA, WB"
Recombinant E. coli BirA protein,Escherichia coli,>=78% SDS-PAGE,N/A,N/A,N/A,"SDS-PAGE, Purification, Biological Activity"
Recombinant Bacteriophage P1 Cre recombinase protein,Escherichia coli,>90% SDS-PAGE,N/A,N/A,N/A,"SDS-PAGE, FuncS"
Native Streptavidin protein (DyLight® 650),Native,N/A,N/A,N/A,N/A,"Flow Cyt, FRET"
Native Staphylococcus aureus Protein A (FITC),Native,>95%,N/A,N/A,N/A,"Flow Cyt, IM, WB, Dot"
Recombinant Human E2F2 protein,Wheat germ,N/A,N/A,N/A,N/A,"SDS-PAGE, ELISA, WB"
Recombinant Human DDB1 protein,Wheat germ,N/A,N/A,N/A,N/A,"SDS-PAGE, ELISA, WB"
Recombinant human coronavirus SARS-CoV-2 PLpro protein (Active),Escherichia coli,>80% SDS-PAGE,N/A,N/A,N/A,"SDS-PAGE, FuncS"
Recombinant human IGFBP2 protein,Insect cells,>98% SDS-PAGE,< 1 EU/µg,5 µg,US$ 150.00,"SDS-PAGE, FuncS, WB"
Recombinant Human Collagen I protein,Wheat germ,N/A,N/A,N/A,N/A,"SDS-PAGE, ELISA, WB"
Recombinant Human Hsp27 protein,Escherichia coli,>95% SDS-PAGE,N/A,100 µg,US$ 300.00,"WB, SDS-PAGE"
