name,expression_system,purity,endotoxin_level,sizes,prices,applications
Recombinant Human MVP protein,Wheat germ,N/A,N/A,N/A,N/A,"ELISA, WB"
Recombinant human Rac1 protein (Active),Escherichia coli,>95% SDS-PAGE,N/A,N/A,N/A,"SDS-PAGE, FuncS"
Recombinant human PTEN protein,Escherichia coli,>=85% SDS-PAGE,N/A,N/A,N/A,"SDS-PAGE, WB, FuncS"
Recombinant Human PRUNE protein,Wheat germ,N/A,N/A,N/A,N/A,"ELISA, WB"
Recombinant human Tet2 protein (Active),Baculovirus infected Sf9 cells,>=90% SDS-PAGE,N/A,N/A,N/A,"SDS-PAGE, FuncS"
Recombinant Human TMED6 protein,Wheat germ,N/A,N/A,N/A,N/A,"ELISA, WB"
Recombinant Human TIPE2 protein,Wheat germ,N/A,N/A,N/A,N/A,"ELISA, WB"
Recombinant Human Tau441 protein,Escherichia coli,>90% SDS-PAGE,N/A,20 µg,US$ 275.00,"SDS-PAGE, WB"
Recombinant mouse Jagged1 protein (Fc Chimera Active),HEK 293 cells,>90% SDS-PAGE,< 0.01 EU/µg,10 µg,US$ 445.00,"SDS-PAGE, Inhib, FuncS"
Recombinant mouse PD1 protein (Active),HEK 293 cells,>90% SDS-PAGE,< 1 EU/µg,N/A,N/A,"SDS-PAGE, FuncS"
Recombinant P. falciparum Histidine-rich protein II (His tag),Escherichia coli,>90% SDS-PAGE,N/A,N/A,N/A,"ELISA, WB, SDS-PAGE"
Recombinant mouse PDE2A protein (Active),Baculovirus infected Sf9 cells,>=86% SDS-PAGE,N/A,N/A,N/A,"SDS-PAGE, FuncS"
Recombinant cynomolgus monkey CSF-1-R protein (His tag),HEK 293 cells,>95% SDS-PAGE,< 1 EU/µg,N/A,N/A,"SDS-PAGE, ELISA"
Recombinant cynomolgus monkey CD40 protein (Active),HEK 293 cells,>95% SDS-PAGE,< 1 EU/µg,N/A,N/A,"SDS-PAGE, FuncS"
Recombinant cynomolgus monkey CD137 protein (Active),HEK 293 cells,>92% SDS-PAGE,< 1 EU/µg,N/A,N/A,"SDS-PAGE, FuncS"
Recombinant cat IL-2 (mutated C146S) protein (Active),Escherichia coli,>95% SDS-PAGE,< 1 EU/µg,N/A,N/A,"SDS-PAGE, FuncS, MS"
Recombinant E. coli Thioredoxin reductase protein,Escherichia coli,>90% SDS-PAGE,N/A,100 µg,US$ 365.00,"SDS-PAGE, MS, FuncS"
Recombinant E. coli Glycine oxidase protein (Active),Escherichia coli,>=90% SDS-PAGE,N/A,250 µg,US$ 870.00,"SDS-PAGE, FuncS"
Recombinant E. coli Thermosensitive gluconokinase protein,Escherichia coli,>90% SDS-PAGE,N/A,N/A,N/A,"SDS-PAGE, FuncS, MS"
Recombinant E. coli surA protein,Escherichia coli,>95% SDS-PAGE,N/A,N/A,N/A,"SDS-PAGE, MS, FuncS"
Recombinant HSP65 protein,Escherichia coli,>90% SDS-PAGE,< 50 EU/mg,N/A,N/A,"SDS-PAGE, FuncS, WB"
Recombinant Human 101F6 protein,Wheat germ,N/A,N/A,N/A,N/A,"ELISA, WB"
Recombinant human ABL1 (mutated Q252H) protein,Baculovirus infected Sf9 cells,>70% Densitometry,N/A,5 µg,US$ 385.00,"SDS-PAGE, FuncS"
Recombinant HIV2 gp36 protein,Escherichia coli,>95% SDS-PAGE,N/A,N/A,N/A,"ELISA, WB"
Recombinant human ABL1 (mutated T315I) protein (Active),Baculovirus infected Sf9 cells,>75% SDS-PAGE,N/A,N/A,N/A,"SDS-PAGE, FuncS"
Recombinant human ABL1 (mutated M351T) protein (Active),Baculovirus infected Sf9 cells,>70% SDS-PAGE,N/A,N/A,N/A,"SDS-PAGE, FuncS"
Recombinant human Activin Receptor Type IA (mutated Q207E) protein (Cytoplasmic domain),Baculovirus infected Sf9 cells,>95% Densitometry,N/A,5 µg,US$ 385.00,"SDS-PAGE, FuncS"
Recombinant human ABL1 (mutated H396P) protein (Active),Baculovirus infected Sf9 cells,>70% SDS-PAGE,N/A,N/A,N/A,"SDS-PAGE, FuncS"
Recombinant human Activin Receptor Type IA (mutated R202I) protein (Active),Baculovirus infected Sf9 cells,>95% SDS-PAGE,N/A,N/A,N/A,"SDS-PAGE, FuncS"
Recombinant human Activin Receptor Type IA (mutated Q207D) protein,Baculovirus infected Sf9 cells,>95% SDS-PAGE,N/A,5 µg,US$ 385.00,"SDS-PAGE, FuncS"
Recombinant human Activin Receptor Type IA (mutated G356D) protein (Active),Baculovirus infected Sf9 cells,>80% SDS-PAGE,N/A,N/A,N/A,"SDS-PAGE, FuncS"
Recombinant Human AGT Protein Standard (His tag),HEK 293 cells,>=80% SDS-PAGE,N/A,N/A,N/A,"SDS-PAGE, sELISA"
Recombinant human ADK protein (Active),Escherichia coli,>95% SDS-PAGE,N/A,N/A,N/A,"SDS-PAGE, FuncS, MS"
Recombinant Human AGPAT5 protein,Wheat germ,N/A,N/A,N/A,N/A,"ELISA, WB"
Recombinant human ALK (mutated G1202R) protein (Active),Baculovirus infected Sf9 cells,>70% Densitometry,N/A,5 µg,US$ 385.00,"SDS-PAGE, FuncS"
Recombinant human ALK (mutated F1174L) protein,Baculovirus infected Sf9 cells,>75% Densitometry,N/A,5 µg,US$ 385.00,"SDS-PAGE, FuncS"
Recombinant human ALK (mutated C1156Y) protein,Baculovirus infected Sf9 cells,>70% Densitometry,N/A,5 µg,US$ 385.00,"SDS-PAGE, FuncS"
Recombinant Human ADIPOR1 protein,Wheat germ,N/A,N/A,N/A,N/A,"ELISA, WB"
Recombinant human Amphiregulin protein (Active),Escherichia coli,>=95% SDS-PAGE,<= 1 EU/µg,50 µg,US$ 320.00,"SDS-PAGE, FuncS"
Recombinant human ALK (mutated F1174S) protein (Active),Baculovirus infected Sf9 cells,>70% SDS-PAGE,N/A,N/A,N/A,"SDS-PAGE, FuncS"
Recombinant human ANGPTL3 protein (His tag),HEK 293 cells,>95% SDS-PAGE,< 1 EU/µg,N/A,N/A,SDS-PAGE
