name,expression_system,purity,endotoxin_level,sizes,prices,applications
Recombinant Human hnRNP K protein,Wheat germ,N/A,N/A,N/A,N/A,"SDS-PAGE, ELISA, WB"
Recombinant Human HMGCS2 protein,Wheat germ,N/A,N/A,N/A,N/A,"SDS-PAGE, ELISA, WB"
Recombinant Human Nkx2.5 protein,Wheat germ,N/A,N/A,N/A,N/A,"SDS-PAGE, ELISA, WB"
Recombinant Human NFAT4/NF-ATc3 protein,Wheat germ,N/A,N/A,N/A,N/A,"SDS-PAGE, ELISA, WB"
Recombinant human TGF beta 1 protein (Active),CHO cells,>95% SDS-PAGE,< 1 EU/µg,5 µg,US$ 335.00,"SDS-PAGE, HPLC, FuncS"
Recombinant Human NF-kB p65 protein (Tagged),Wheat germ,N/A,N/A,N/A,N/A,"SDS-PAGE, ELISA, WB"
Recombinant Human Neuropeptide Y protein,Wheat germ,N/A,N/A,N/A,N/A,"SDS-PAGE, ELISA, WB"
Recombinant Human Tau441 (mutated V337M) protein,Escherichia coli,>90% Densitometry,N/A,20 µg,US$ 285.00,"SDS-PAGE, WB"
Recombinant Human Tenascin C protein,Wheat germ,N/A,N/A,N/A,N/A,"SDS-PAGE, ELISA, WB"
Recombinant Human TDP1 protein,Wheat germ,N/A,N/A,N/A,N/A,"SDS-PAGE, ELISA, WB"
Recombinant OmpA protein (Tagged),Escherichia coli,>90% SDS-PAGE,N/A,N/A,N/A,"SDS-PAGE, MS"
Recombinant mouse VEGFA protein (Active),HEK 293 cells,>95% SDS-PAGE,< 1 EU/µg,N/A,N/A,"SDS-PAGE, FuncS"
Recombinant Norovirus GII.4VP1 virus-like particles,HEK 293 cells,>95% SDS-PAGE,N/A,N/A,N/A,SDS-PAGE
"Recombinant Mumps virus wild-type, Gloucester strain, nucleocapsid protein",Saccharomyces cerevisiae,>95% SDS-PAGE,N/A,N/A,N/A,"ELISA, WB, SDS-PAGE"
Recombinant cynomolgus monkey Folate Binding Protein/FBP (Active),HEK 293 cells,>90% SDS-PAGE,< 1 EU/µg,N/A,N/A,"FuncS, SDS-PAGE"
Recombinant cynomolgus monkey CSF-1-R protein (Fc Chimera Active),HEK 293 cells,>95% SDS-PAGE,< 1 EU/µg,N/A,N/A,"SDS-PAGE, ELISA"
Recombinant Cynomolgus monkey IL-4 protein (His tag),Yeast,>90% SDS-PAGE,N/A,N/A,N/A,"SDS-PAGE, MS"
Recombinant Cyanovirin-N homologue protein (His tag),Yeast,>90% SDS-PAGE,N/A,N/A,N/A,"SDS-PAGE, MS"
Recombinant HIV tat (mutated C22) protein,Escherichia coli,>90% SDS-PAGE,N/A,N/A,N/A,"SDS-PAGE, WB, BL, FuncS"
Recombinant Hepatitis C Virus NS5 protein,Escherichia coli,>95% SDS-PAGE,N/A,N/A,N/A,"ELISA, WB, Flow Cyt"
Recombinant Hepatitis C Virus genotype 1a NS5 protein,Escherichia coli,>95% SDS-PAGE,N/A,N/A,N/A,"ELISA, WB, Flow Cyt"
"Recombinant Hantavirus Puumala, strain Vranica, nucleocapsid protein",Yeast,>95% SDS-PAGE,N/A,N/A,N/A,"ELISA, WB, SDS-PAGE"
Recombinant Human Activin Receptor Type IIA/ACVR2A protein,Wheat germ,N/A,N/A,N/A,N/A,"SDS-PAGE, ELISA, WB"
Recombinant Human Activin Receptor Type IIB/ACVR2B protein,Wheat germ,N/A,N/A,N/A,N/A,"SDS-PAGE, ELISA, WB"
Recombinant Human ACSL1 protein,Wheat germ,N/A,N/A,N/A,N/A,"SDS-PAGE, ELISA, WB"
Recombinant Human Aconitase 2 protein,Wheat germ,N/A,N/A,N/A,N/A,"SDS-PAGE, ELISA, WB"
Recombinant human Alpha-Synuclein protein monomer,Escherichia coli,>95% SDS-PAGE,< 0.1 EU/µg,N/A,N/A,"SDS-PAGE, MS, HPLC"
Recombinant Human AMBN protein,Wheat germ,N/A,N/A,N/A,N/A,"SDS-PAGE, ELISA, WB"
Recombinant Human ALS protein,Wheat germ,N/A,N/A,N/A,N/A,"SDS-PAGE, ELISA, WB"
Recombinant Human alpha Sarcoglycan protein,Wheat germ,N/A,N/A,N/A,N/A,"SDS-PAGE, ELISA, WB"
Recombinant Human alpha COP I/COPA protein,Wheat germ,N/A,N/A,N/A,N/A,"SDS-PAGE, ELISA, WB"
Recombinant Human ARHGAP12 protein,Wheat germ,N/A,N/A,N/A,N/A,"SDS-PAGE, ELISA, WB"
Recombinant Human Aquaporin 2 protein,Wheat germ,N/A,N/A,N/A,N/A,"SDS-PAGE, ELISA, WB"
Recombinant Human Aquaporin 1 protein,Wheat germ,N/A,N/A,N/A,N/A,"SDS-PAGE, ELISA, WB"
Recombinant Human Apolipoprotein L1/APOL1,Wheat germ,>80%,N/A,N/A,N/A,"SDS-PAGE, ELISA, WB"
Recombinant Human Bag1 protein,Escherichia coli,>90% SDS-PAGE,N/A,N/A,N/A,"SDS-PAGE, WB"
Recombinant Human Bak protein,Wheat germ,N/A,N/A,N/A,N/A,"SDS-PAGE, ELISA, WB"
Recombinant Human BACH1.3 protein,Wheat germ,N/A,N/A,N/A,N/A,"SDS-PAGE, ELISA, WB"
Recombinant Human B2R protein,Wheat germ,N/A,N/A,N/A,N/A,"SDS-PAGE, ELISA, WB"
Recombinant Human Bmf protein,Escherichia coli,>90% SDS-PAGE,N/A,N/A,N/A,"WB, SDS-PAGE"
Recombinant Human BMAL1 protein,Wheat germ,N/A,N/A,N/A,N/A,"SDS-PAGE, ELISA, WB"
Recombinant Human Blood Group Kell Antigen protein,Wheat germ,N/A,N/A,N/A,N/A,"SDS-PAGE, ELISA, WB"
Recombinant Human BI-1 protein,Wheat germ,N/A,N/A,N/A,N/A,"SDS-PAGE, ELISA, WB"
Recombinant Human CAB3 protein,Wheat germ,N/A,N/A,N/A,N/A,"SDS-PAGE, ELISA, WB"
Recombinant Human C9 protein,Wheat germ,N/A,N/A,N/A,N/A,"SDS-PAGE, ELISA, WB"
Recombinant Human C4orf27 protein (Tagged),Escherichia coli,>85% SDS-PAGE,N/A,N/A,N/A,"SDS-PAGE, MS"
Recombinant Human C4b protein,Wheat germ,N/A,N/A,N/A,N/A,"SDS-PAGE, ELISA, WB"
Recombinant Human CCK4 protein (His tag),Yeast,>90% SDS-PAGE,N/A,N/A,N/A,"SDS-PAGE, MS"
Recombinant Human CCK2-R protein,Wheat germ,N/A,N/A,N/A,N/A,"SDS-PAGE, ELISA, WB"
Recombinant Human CBX4 protein,Wheat germ,N/A,N/A,N/A,N/A,"SDS-PAGE, ELISA, WB"
Recombinant Human CBX1 / HP1 beta protein,Escherichia coli,>85% SDS-PAGE,N/A,N/A,N/A,"SDS-PAGE, WB"
Recombinant human CD226 protein (Active),HEK 293 cells,>95% SDS-PAGE,< 1 EU/µg,N/A,N/A,"FuncS, SDS-PAGE"
Recombinant Human CD200 / OX2 protein (Fc Chimera),HEK 293 cells,>95% SDS-PAGE,< 1 EU/µg,N/A,N/A,"SDS-PAGE, ELISA"
Recombinant Human CD27 protein,Wheat germ,N/A,N/A,N/A,N/A,"SDS-PAGE, ELISA, WB"
Recombinant Human CD200 / OX2 protein,Wheat germ,N/A,N/A,N/A,N/A,"SDS-PAGE, ELISA, WB"
Recombinant Human CD74 protein,Escherichia coli,>90% SDS-PAGE,N/A,N/A,N/A,"SDS-PAGE, MS"
Recombinant Human CD8 alpha protein,Wheat germ,N/A,N/A,N/A,N/A,"SDS-PAGE, ELISA, WB"
Recombinant Human CD64 protein,Wheat germ,N/A,N/A,N/A,N/A,"SDS-PAGE, ELISA, WB"
Recombinant Human CD62L protein,Wheat germ,N/A,N/A,N/A,N/A,"SDS-PAGE, ELISA, WB"
Recombinant Human CITED1 protein,Wheat germ,N/A,N/A,N/A,N/A,"SDS-PAGE, ELISA, WB"
Recombinant Human CISH/CIS protein,Wheat germ,N/A,N/A,N/A,N/A,"SDS-PAGE, ELISA, WB"
Recombinant Human cIAP1 protein,Wheat germ,N/A,N/A,N/A,N/A,"SDS-PAGE, ELISA, WB"
Recombinant human coronavirus SARS-CoV-2 Spike Glycoprotein S1 (mut W152C + L452R + D614G) (Active),HEK 293 cells,>90% SDS-PAGE,< 1 EU/µg,N/A,N/A,"SDS-PAGE, FuncS"
Recombinant Human Choline kinase alpha protein,Wheat germ,N/A,N/A,N/A,N/A,"SDS-PAGE, ELISA, WB"
Recombinant Human Corneodesmosin/S protein,Wheat germ,N/A,N/A,N/A,N/A,"SDS-PAGE, ELISA, WB"
Recombinant Human COPS6 protein,Wheat germ,N/A,N/A,N/A,N/A,"SDS-PAGE, ELISA, WB"
Recombinant Human COMP/Cartilage oligomeric matrix protein,HEK 293 cells,>90% SDS-PAGE,N/A,N/A,N/A,"SDS-PAGE, WB"
Recombinant Human CRMP3 protein,Wheat germ,N/A,N/A,N/A,N/A,"SDS-PAGE, ELISA, WB"
Recombinant human Cripto1/CRIPTO protein (Fc Chimera),HEK 293 cells,>95% SDS-PAGE,N/A,N/A,N/A,"FuncS, SDS-PAGE"
Recombinant Human CRMP2 protein,Wheat germ,N/A,N/A,N/A,N/A,"SDS-PAGE, ELISA, WB"
Recombinant Human CRM1 protein,Wheat germ,N/A,N/A,N/A,N/A,"SDS-PAGE, ELISA, WB"
Recombinant Human CYP11A1 protein,Wheat germ,N/A,N/A,N/A,N/A,"SDS-PAGE, ELISA, WB"
Recombinant Human Cyclin T1 protein,Wheat germ,N/A,N/A,N/A,N/A,"SDS-PAGE, ELISA, WB"
Recombinant Human CXCR3 protein,Wheat germ,N/A,N/A,N/A,N/A,"SDS-PAGE, ELISA, WB"
Recombinant Human CXCR2 protein,Wheat germ,N/A,N/A,N/A,N/A,"SDS-PAGE, ELISA, WB"
Recombinant Human DC-SIGN protein,Wheat germ,N/A,N/A,N/A,N/A,"SDS-PAGE, ELISA, WB"
Recombinant Human Daxx protein,Wheat germ,N/A,N/A,N/A,N/A,"SDS-PAGE, ELISA, WB"
Recombinant Human DARC protein,Wheat germ,N/A,N/A,N/A,N/A,"SDS-PAGE, ELISA, WB"
Recombinant Human DAP3 protein,Wheat germ,N/A,N/A,N/A,N/A,"SDS-PAGE, ELISA, WB"
Recombinant Human DNAJA2 protein,Wheat germ,N/A,N/A,N/A,N/A,"SDS-PAGE, ELISA, WB"
Recombinant Human DNAJA1 protein,Escherichia coli,>90% SDS-PAGE,N/A,N/A,N/A,"SDS-PAGE, WB"
Recombinant Human EFEMP1/Fibulin-3 protein (His tag),HEK 293 cells,>=95% HPLC,<= 0.005 EU/µg,10 µg,US$ 205.00,"MS, HPLC, SDS-PAGE"
Recombinant Human DNA polymerase eta protein,Wheat germ,N/A,N/A,N/A,N/A,"SDS-PAGE, ELISA, WB"
Recombinant Human DNA polymerase alpha/POLA protein,Wheat germ,N/A,N/A,N/A,N/A,"SDS-PAGE, ELISA, WB"
Recombinant Human EFHD2/SWS1 protein,Wheat germ,N/A,N/A,N/A,N/A,"SDS-PAGE, ELISA, WB"
Recombinant Human EFEMP1/Fibulin-3 protein,Wheat germ,N/A,N/A,N/A,N/A,"SDS-PAGE, ELISA, WB"
Recombinant Human EDG2 /LPA-1 protein,Wheat germ,N/A,N/A,N/A,N/A,"SDS-PAGE, ELISA, WB"
Recombinant human Eph receptor A1/EphA1 protein,Baculovirus,>90% Densitometry,N/A,5 µg,US$ 450.00,"WB, FuncS"
Recombinant Human Eph receptor A2 protein,Wheat germ,N/A,N/A,N/A,N/A,"SDS-PAGE, ELISA, WB"
Recombinant Human Factor H protein,Wheat germ,N/A,N/A,2 µg,US$ 740.00,"SDS-PAGE, ELISA, WB"
Recombinant Human EPB41L3/DAL1 protein,Wheat germ,N/A,N/A,N/A,N/A,"SDS-PAGE, ELISA, WB"
Recombinant Human EPB41 protein,Wheat germ,N/A,N/A,N/A,N/A,"SDS-PAGE, ELISA, WB"
Recombinant Human FAIM2/LFG protein,Wheat germ,N/A,N/A,N/A,N/A,"SDS-PAGE, ELISA, WB"
Recombinant Human FABP4 protein,Escherichia coli,>90% SDS-PAGE,N/A,N/A,N/A,"ELISA, WB"
Recombinant Human FAAH1 protein,Wheat germ,N/A,N/A,N/A,N/A,"SDS-PAGE, ELISA, WB"
Recombinant Human Fibrillin 2 protein,Wheat germ,N/A,N/A,N/A,N/A,"SDS-PAGE, ELISA, WB"
Recombinant Human FHL2 protein,Wheat germ,N/A,N/A,N/A,N/A,"SDS-PAGE, ELISA, WB"
Recombinant Human FHL1 protein,Wheat germ,N/A,N/A,N/A,N/A,"SDS-PAGE, ELISA, WB"
Recombinant Human Frataxin protein (His-tag),Escherichia coli,>=95% HPLC,<= 0.1 EU/mg,10 µg,US$ 95.00,"HPLC, SDS-PAGE, MS"
Recombinant Human FGL1 protein,Wheat germ,N/A,N/A,N/A,N/A,"SDS-PAGE, ELISA, WB"
Recombinant Human FRS2 protein,Wheat germ,N/A,N/A,N/A,N/A,"SDS-PAGE, ELISA, WB"
Recombinant Human Frizzled 6 protein,Wheat germ,N/A,N/A,N/A,N/A,"SDS-PAGE, ELISA, WB"
Recombinant Human FPRL1/RFP protein,Wheat germ,N/A,N/A,N/A,N/A,"SDS-PAGE, ELISA, WB"
Recombinant Human FOXP1 protein,Wheat germ,N/A,N/A,N/A,N/A,"SDS-PAGE, ELISA, WB"
Recombinant Human Gastrin protein,Wheat germ,N/A,N/A,N/A,N/A,"SDS-PAGE, ELISA, WB"
Recombinant Human GAS 6 protein,Wheat germ,N/A,N/A,N/A,N/A,"SDS-PAGE, ELISA, WB"
Recombinant Human GAP43 protein,Wheat germ,>=80%,N/A,N/A,N/A,N/A
Recombinant Human gamma Catenin protein,Wheat germ,N/A,N/A,N/A,N/A,"SDS-PAGE, ELISA, WB"
Recombinant Human Glycophorin A protein,N/A,N/A,N/A,N/A,N/A,"SDS-PAGE, ELISA, WB"
Recombinant Human Glutaredoxin 1 protein,Escherichia coli,>95% SDS-PAGE,N/A,100 µg,US$ 290.00,"SDS-PAGE, WB"
Recombinant Human GRP94 protein,Escherichia coli,>90% SDS-PAGE,N/A,100 µg,US$ 685.00,"SDS-PAGE, WB"
Recombinant Human Gli1 protein,Wheat germ,N/A,N/A,N/A,N/A,"SDS-PAGE, ELISA, WB"
Recombinant Human GRPR protein,Wheat germ,N/A,N/A,N/A,N/A,"SDS-PAGE, ELISA, WB"
Recombinant Human GLUD2 protein,Wheat germ,N/A,N/A,N/A,N/A,"SDS-PAGE, ELISA, WB"
Recombinant Human Grp75/MOT protein,Escherichia coli,>=80% SDS-PAGE,N/A,N/A,N/A,"SDS-PAGE, WB"
Recombinant Human hHR23A protein,Wheat germ,N/A,N/A,N/A,N/A,"SDS-PAGE, ELISA, WB"
Recombinant Human Hepcidin protein,Wheat germ,N/A,N/A,N/A,N/A,"SDS-PAGE, ELISA, WB"
Recombinant Human HES6 protein,Wheat germ,N/A,N/A,N/A,N/A,"SDS-PAGE, ELISA, WB"
Recombinant Human Hes1 protein,Wheat germ,N/A,N/A,N/A,N/A,"SDS-PAGE, ELISA, WB"
Recombinant Human Heparan Sulfate Proteoglycan 2/Perlecan protein (Tagged),Wheat germ,N/A,N/A,N/A,N/A,"SDS-PAGE, ELISA, WB"
Recombinant Human HOXB4 protein,Wheat germ,N/A,N/A,N/A,N/A,"SDS-PAGE, ELISA, WB"
Recombinant Human HOXB7 protein,Wheat germ,N/A,N/A,N/A,N/A,"SDS-PAGE, ELISA, WB"
Recombinant Human HOXA9 protein,Wheat germ,N/A,N/A,N/A,N/A,"SDS-PAGE, ELISA, WB"
Recombinant Human HOXA5 protein,Wheat germ,N/A,N/A,N/A,N/A,"SDS-PAGE, ELISA, WB"
Recombinant Human IGSF11 protein (Tagged),HEK 293 cells,>=90% SDS-PAGE,N/A,N/A,N/A,"WB, SDS-PAGE"
Recombinant Human IFITM1 protein,Wheat germ,N/A,N/A,N/A,N/A,"SDS-PAGE, ELISA, WB"
Recombinant Human IFIT2 protein,Wheat germ,N/A,N/A,N/A,N/A,"SDS-PAGE, ELISA, WB"
Recombinant Human IFIT1 protein,Wheat germ,N/A,N/A,N/A,N/A,"SDS-PAGE, ELISA, WB"
Recombinant Human Integrin beta 7 protein,Wheat germ,N/A,N/A,N/A,N/A,"SDS-PAGE, ELISA, WB"
Recombinant Human Integrin beta 1 protein,Wheat germ,N/A,N/A,2 µg,US$ 740.00,"ELISA, SDS-PAGE, WB"
Recombinant Human Kallikrein 6 Protein (His tag),HEK 293 cells,>=95% HPLC,<= 0.005 EU/µg,10 µg,US$ 460.00,"MS, HPLC, SDS-PAGE"
Recombinant Human Integrin alpha V protein (Tagged),Wheat germ,N/A,N/A,N/A,N/A,"SDS-PAGE, ELISA, WB"
Recombinant Human Integrin alpha 1 protein,Wheat germ,N/A,N/A,N/A,N/A,"SDS-PAGE, ELISA, WB"
Recombinant Human KAP1 protein,Wheat germ,N/A,N/A,N/A,N/A,"SDS-PAGE, ELISA, WB"
Recombinant Human JAK2 protein (Tagged) (Biotin),Baculovirus infected Sf9 cells,>=90% SDS-PAGE,N/A,N/A,N/A,"SDS-PAGE, WB"
Recombinant Human JunB protein,Wheat germ,N/A,N/A,N/A,N/A,"SDS-PAGE, ELISA, WB"
Recombinant human LAIR2 protein,HEK 293 cells,>95% SDS-PAGE,< 1 EU/µg,N/A,N/A,"SDS-PAGE, FuncS"
Recombinant Human Lamin B Receptor/LBR protein,Wheat germ,N/A,N/A,N/A,N/A,"SDS-PAGE, ELISA, WB"
Recombinant Human kynurenine 3-monooxygenase protein,Wheat germ,N/A,N/A,N/A,N/A,"SDS-PAGE, ELISA, WB"
Recombinant Human LAD1 protein,Wheat germ,N/A,N/A,N/A,N/A,"SDS-PAGE, ELISA, WB"
Recombinant Human M6PR (cation dependent) protein,Escherichia coli,>90% SDS-PAGE,N/A,N/A,N/A,"SDS-PAGE, ELISA, WB"
Recombinant Human MADH7/SMAD7 protein,Wheat germ,N/A,N/A,N/A,N/A,"SDS-PAGE, ELISA, WB"
Recombinant Human LRP5 protein,Wheat germ,N/A,N/A,N/A,N/A,"SDS-PAGE, ELISA, WB"
Recombinant Human LTBP1 protein,Wheat germ,N/A,N/A,N/A,N/A,"SDS-PAGE, ELISA, WB"
Recombinant Human MEIS1 protein,Wheat germ,N/A,N/A,N/A,N/A,"SDS-PAGE, ELISA, WB"
Recombinant Human MEF2D protein,Wheat germ,N/A,N/A,N/A,N/A,"SDS-PAGE, ELISA, WB"
Recombinant Human MMP9 Protein (His tag),HEK 293 cells,>=95% HPLC,<= 0.005 EU/µg,10 µg,US$ 530.00,"HPLC, SDS-PAGE, MS"
Recombinant Human MEF2C protein,Wheat germ,N/A,N/A,N/A,N/A,"SDS-PAGE, ELISA, WB"
Recombinant Human ME1 protein,Wheat germ,N/A,N/A,N/A,N/A,"SDS-PAGE, ELISA, WB"
Recombinant Human MNK1 protein,Baculovirus infected Sf9 cells,>70% SDS-PAGE,N/A,N/A,N/A,"WB, FuncS"
Recombinant Human MMP12 protein,Wheat germ,N/A,N/A,N/A,N/A,"SDS-PAGE, ELISA, WB"
Recombinant Human MLH1 protein,Wheat germ,N/A,N/A,N/A,N/A,"SDS-PAGE, ELISA, WB"
Recombinant Human Natriuretic peptides A protein,Wheat germ,N/A,N/A,N/A,N/A,"SDS-PAGE, ELISA, WB"
Recombinant Human n-Myc/MYCN protein,Wheat germ,N/A,N/A,N/A,N/A,"SDS-PAGE, ELISA, WB"
Recombinant Human N-ethylmaleimide-sensitive fusion protein,Wheat germ,N/A,N/A,N/A,N/A,"SDS-PAGE, ELISA, WB"
Recombinant Human NFAT2 protein,Baculovirus infected Sf9 cells,>85% Densitometry,N/A,N/A,N/A,"SDS-PAGE, WB"
Recombinant Human Myosin VIIa/MYO7A protein,Wheat germ,N/A,N/A,N/A,N/A,"SDS-PAGE, ELISA, WB"
Recombinant human Neuropilin 1 protein (Fc Chimera Active),HEK 293 cells,>95% SDS-PAGE,< 1 EU/µg,N/A,N/A,"SDS-PAGE, FuncS"
Recombinant Human NF2 / Merlin protein,Wheat germ,N/A,N/A,N/A,N/A,"SDS-PAGE, ELISA, WB"
Recombinant human Neuropilin 1 protein,Insect cells,>95% SDS-PAGE,N/A,N/A,N/A,"SDS-PAGE, FuncS"
Recombinant Human NPR-A protein (Tagged),Escherichia coli,>90% SDS-PAGE,N/A,N/A,N/A,"SDS-PAGE, MS"
Recombinant Human NPR-C protein,Wheat germ,N/A,N/A,N/A,N/A,"SDS-PAGE, ELISA, WB"
Recombinant Human NOXA2/p67phox protein,Wheat germ,N/A,N/A,N/A,N/A,"SDS-PAGE, ELISA, WB"
Recombinant Human Noxa protein,Wheat germ,N/A,N/A,N/A,N/A,"SDS-PAGE, ELISA, WB"
Recombinant Human OLFM4 protein,Wheat germ,N/A,N/A,N/A,N/A,"SDS-PAGE, ELISA, WB"
Recombinant Human OGT / O-Linked N-Acetylglucosamine Transferase protein,Wheat germ,N/A,N/A,N/A,N/A,"SDS-PAGE, ELISA, WB"
Recombinant human Parathyroid Hormone protein (Active),Escherichia coli,>95% SDS-PAGE,< 1 EU/µg,10 µg,US$ 235.00,"SDS-PAGE, FuncS, MS"
Recombinant Human Occludin protein,Wheat germ,N/A,N/A,N/A,N/A,"SDS-PAGE, ELISA, WB"
Recombinant Human OAS2 protein,Wheat germ,N/A,N/A,2 µg,US$ 740.00,"SDS-PAGE, ELISA, WB"
Recombinant Human Peroxiredoxin 2/PRP protein (His tag),Escherichia coli,>90% SDS-PAGE,N/A,N/A,N/A,"SDS-PAGE, MS"
Recombinant Human PAR6 protein,Wheat germ,N/A,N/A,N/A,N/A,"SDS-PAGE, ELISA, WB"
Recombinant Human PAR4 protein,Wheat germ,N/A,N/A,N/A,N/A,"SDS-PAGE, ELISA, WB"
Recombinant Human PAR1/Thrombin Receptor protein,Wheat germ,N/A,N/A,N/A,N/A,"SDS-PAGE, ELISA, WB"
Recombinant Human Periostin protein (His Tag),HEK 293 cells,>=95% HPLC,<= 0.005 EU/µg,10 µg,US$ 95.00,"HPLC, MS, SDS-PAGE"
Recombinant Human PLGF Protein,HEK 293 cells,>=95% HPLC,<= 0.005 EU/µg,10 µg,US$ 165.00,"HPLC, SDS-PAGE, MS"
Recombinant Human Peripherin protein,Wheat germ,>=80%,N/A,N/A,N/A,"SDS-PAGE, ELISA, WB"
Recombinant human PKM2 protein (His tag),Escherichia coli,>=95% HPLC,<= 0.005 EU/µg,10 µg,US$ 95.00,"MS, HPLC, SDS-PAGE"
Recombinant Human Perilipin-1 protein,Wheat germ,N/A,N/A,N/A,N/A,"SDS-PAGE, ELISA, WB"
Recombinant Human Plexin B2/MM1 protein,Wheat germ,N/A,N/A,N/A,N/A,"SDS-PAGE, ELISA, WB"
Recombinant Human Placental alkaline phosphatase (PLAP) protein,Wheat germ,N/A,N/A,N/A,N/A,"SDS-PAGE, ELISA, WB"
Recombinant Human PRDM1/Blimp1 protein,Wheat germ,N/A,N/A,N/A,N/A,"SDS-PAGE, ELISA, WB"
Recombinant Human PRAME protein,Wheat germ,N/A,N/A,N/A,N/A,"SDS-PAGE, ELISA, WB"
Recombinant Human PPT1/PPT protein,Wheat germ,N/A,N/A,N/A,N/A,"SDS-PAGE, ELISA, WB"
Recombinant Human PPP2R5D protein,Wheat germ,N/A,N/A,N/A,N/A,"SDS-PAGE, ELISA, WB"
Recombinant Human Rab5A protein,Escherichia coli,>95% SDS-PAGE,N/A,N/A,N/A,"SDS-PAGE, WB"
Recombinant Human RAB11FIP1 protein,Wheat germ,N/A,N/A,N/A,N/A,"SDS-PAGE, ELISA, WB"
Recombinant Human Quiescin Q6 protein,Wheat germ,N/A,N/A,N/A,N/A,"SDS-PAGE, ELISA, WB"
Recombinant Human PYK2 protein,Wheat germ,N/A,N/A,N/A,N/A,"SDS-PAGE, ELISA, WB"
Recombinant human RIPK5 protein,Baculovirus infected Sf9 cells,>85% Densitometry,N/A,5 µg,US$ 460.00,"WB, FuncS"
Recombinant Human RNA Helicase A protein,Wheat germ,N/A,N/A,N/A,N/A,"SDS-PAGE, ELISA, WB"
Recombinant Human RING1 protein,Wheat germ,N/A,N/A,N/A,N/A,"SDS-PAGE, ELISA, WB"
Recombinant Human RIG-I/DDX58 protein,Wheat germ,N/A,N/A,N/A,N/A,"SDS-PAGE, ELISA, WB"
Recombinant human Sclerostin protein (Active),HEK 293 cells,>95% SDS-PAGE,< 1 EU/µg,N/A,N/A,"ELISA, SDS-PAGE"
Recombinant Human SCN2A protein,Wheat germ,N/A,N/A,N/A,N/A,"SDS-PAGE, ELISA, WB"
Recombinant Human SCF (Active) protein,Escherichia coli,>95% HPLC,< 1 EU/µg,100 µg,US$ 330.00,N/A
Recombinant Human SC35 protein,Wheat germ,N/A,N/A,N/A,N/A,"SDS-PAGE, ELISA, WB"
Recombinant Human Slit3 protein,Wheat germ,N/A,N/A,N/A,N/A,"SDS-PAGE, ELISA, WB"
Recombinant Human SLC27A4 / FATP4 protein,Wheat germ,N/A,N/A,N/A,N/A,"SDS-PAGE, ELISA, WB"
Recombinant Human SLC26A4 protein,Wheat germ,N/A,N/A,N/A,N/A,"SDS-PAGE, ELISA, WB"
Recombinant Human SKP2 protein,Wheat germ,>=80%,N/A,N/A,N/A,"SDS-PAGE, ELISA, WB"
Recombinant Human Somatostatin Receptor 2 protein,Wheat germ,N/A,N/A,N/A,N/A,"SDS-PAGE, ELISA, WB"
Recombinant Human SorLA/SORL1 protein,Wheat germ,N/A,N/A,N/A,N/A,"SDS-PAGE, ELISA, WB"
Recombinant Human Soluble TNF Receptor II protein,Wheat germ,N/A,N/A,N/A,N/A,"SDS-PAGE, ELISA, WB"
Recombinant Human STAT5a protein,Baculovirus infected Sf9 cells,>90% SDS-PAGE,N/A,20 µg,US$ 385.00,"SDS-PAGE, WB"
Recombinant Human Sodium/Hydrogen Exchanger 1/NHE-1 protein,Wheat germ,N/A,N/A,N/A,N/A,"SDS-PAGE, ELISA, WB"
Recombinant Human Stanniocalcin 1/STC protein,HEK 293 cells,>95% SDS-PAGE,N/A,N/A,N/A,"SDS-PAGE, ELISA, WB"
Recombinant Human STAM2 protein,Wheat germ,N/A,N/A,N/A,N/A,"SDS-PAGE, ELISA, WB"
Recombinant Human ST14 protein,Wheat germ,N/A,N/A,N/A,N/A,"SDS-PAGE, ELISA, WB"
Recombinant Human SRSF3 protein,Wheat germ,N/A,N/A,N/A,N/A,"SDS-PAGE, ELISA, WB"
Recombinant Human TBRG4 protein,Wheat germ,N/A,N/A,N/A,N/A,"SDS-PAGE, ELISA, WB"
Recombinant Human TBR2 / Eomes protein,Wheat germ,N/A,N/A,N/A,N/A,"SDS-PAGE, ELISA, WB"
Recombinant Human Tafazzin / TAZ protein,Wheat germ,N/A,N/A,N/A,N/A,"SDS-PAGE, ELISA, WB"
Recombinant Human TIM 3 protein (Fc Chimera),HEK 293 cells,>85% SDS-PAGE,< 1 EU/µg,N/A,N/A,"SDS-PAGE, ELISA"
Recombinant Human Syntaxin-5 protein,Wheat germ,N/A,N/A,N/A,N/A,"SDS-PAGE, ELISA, WB"
Recombinant Human TIM 4 protein (Tagged),HEK 293 cells,>=90% SDS-PAGE,N/A,N/A,N/A,"WB, SDS-PAGE"
Recombinant Human TIA1 protein,Wheat germ,N/A,N/A,N/A,N/A,"SDS-PAGE, ELISA, WB"
Recombinant Human Thyroxine Binding Globulin protein,Wheat germ,N/A,N/A,N/A,N/A,"SDS-PAGE, ELISA, WB"
Recombinant Human Transportin 1/MIP protein,Wheat germ,N/A,N/A,N/A,N/A,"SDS-PAGE, ELISA, WB"
Recombinant Human Transglutaminase 2 protein,Wheat germ,N/A,N/A,N/A,N/A,"SDS-PAGE, ELISA, WB"
Recombinant Human TRAF6 protein,Wheat germ,N/A,N/A,N/A,N/A,"SDS-PAGE, ELISA, WB"
Recombinant Human TRAF3 protein,Wheat germ,N/A,N/A,N/A,N/A,"SDS-PAGE, ELISA, WB"
Recombinant Human UCP3 protein,Escherichia coli,>90% SDS-PAGE,N/A,N/A,N/A,"SDS-PAGE, ELISA, WB"
Recombinant Human USP1 protein (Tagged),Wheat germ,N/A,N/A,N/A,N/A,"SDS-PAGE, ELISA, WB"
Recombinant Human UCP1 protein,Wheat germ,N/A,N/A,N/A,N/A,"SDS-PAGE, ELISA, WB"
Recombinant Human WDR77 protein (Tagged),Escherichia coli,>90% SDS-PAGE,N/A,N/A,N/A,"SDS-PAGE, MS"
Recombinant Human U1A protein,Wheat germ,N/A,N/A,N/A,N/A,"SDS-PAGE, ELISA, WB"
Recombinant Human WASP/Wiskott-Aldrich syndrome protein,Wheat germ,N/A,N/A,N/A,N/A,"SDS-PAGE, ELISA, WB"
Recombinant mouse CD272/BTLA protein (Active),HEK 293 cells,>95% SDS-PAGE,< 1 EU/µg,N/A,N/A,"SDS-PAGE, FuncS, ELISA"
Recombinant Human VPS41 protein,Wheat germ,N/A,N/A,N/A,N/A,"SDS-PAGE, ELISA, WB"
Recombinant Human VPS35 protein,Wheat germ,N/A,N/A,N/A,N/A,"SDS-PAGE, ELISA, WB"
Recombinant Mouse CD27 protein (Tagged),HEK 293 cells,>=90% SDS-PAGE,N/A,N/A,N/A,"SDS-PAGE, WB"
Recombinant Mouse MIP-1 alpha/CCL3 Protein (His-tag),HEK 293 cells,>=95% HPLC,<= 1.63 EU/mg,10 µg,US$ 115.00,"HPLC, MS, SDS-PAGE"
Recombinant Mouse Carboxylesterase 1C protein (His tag),Yeast,>90% SDS-PAGE,N/A,N/A,N/A,"SDS-PAGE, MS"
Recombinant Mouse MIF Protein (His-tag),HEK 293 cells,>=95% HPLC,<= 1.39 EU/mg,10 µg,US$ 105.00,"HPLC, MS, SDS-PAGE"
Recombinant Mouse Calreticulin protein (His tag),Yeast,>90% SDS-PAGE,N/A,N/A,N/A,"SDS-PAGE, MS"
Recombinant Mouse MUSK protein (Tagged),Escherichia coli,>90% SDS-PAGE,N/A,N/A,N/A,"SDS-PAGE, MS"
Recombinant Mouse Mast Cell Tryptase protein (His tag),Escherichia coli,>90% SDS-PAGE,N/A,N/A,N/A,"SDS-PAGE, MS"
Recombinant Pseudomonas aeruginosa Regulatory protein RhlR (His tag),Escherichia coli,>90% SDS-PAGE,N/A,N/A,N/A,"SDS-PAGE, MS"
Recombinant Polyomavirus strain RA Major Capsid VP1 protein,Saccharomyces cerevisiae,>75% SDS-PAGE,N/A,N/A,N/A,"ELISA, WB, SDS-PAGE"
Recombinant Pectate lyase 1 protein (Tagged),Escherichia coli,>90% SDS-PAGE,N/A,N/A,N/A,"SDS-PAGE, MS"
Recombinant UVSX protein (Tagged),Escherichia coli,>90% SDS-PAGE,N/A,20 µg,US$ 590.00,"SDS-PAGE, MS"
Recombinant Tobacco Osmotin protein (His tag),Escherichia coli,>90% SDS-PAGE,N/A,N/A,N/A,"SDS-PAGE, MS"
Recombinant uvsY protein (His tag),Escherichia coli,>90% SDS-PAGE,N/A,N/A,N/A,"SDS-PAGE, MS"
Recombinant T. gondii Toxoplasma gondii protein,Escherichia coli,>95% SDS-PAGE,N/A,N/A,N/A,"ELISA, WB, Flow Cyt"
Recombinant Human Acid sphingomyelinase protein,Wheat germ,N/A,N/A,N/A,N/A,"SDS-PAGE, ELISA, WB"
Native human Plasminogen protein (Active),Native,>95% SDS-PAGE,N/A,N/A,N/A,SDS-PAGE
Recombinant Human 5HT1A Receptor protein,Wheat germ,N/A,N/A,N/A,N/A,"SDS-PAGE, ELISA, WB"
CX3CR1 peptide,N/A,HPLC,N/A,N/A,N/A,"WB, BL"
Recombinant Simian Virus 40 SV40 Large T Antigen protein,Baculovirus,>95%,< 1 EU/µg,N/A,N/A,SDS-PAGE
Recombinant Human Wnt5a protein,Escherichia coli,>=90% SDS-PAGE,N/A,N/A,N/A,SDS-PAGE
Recombinant Human Neurofascin protein (His tag),HEK 293 cells,>95% SDS-PAGE,< 1 EU/µg,N/A,N/A,SDS-PAGE
Recombinant Human Tissue Plasminogen Activator protein (FITC),CHO cells,>95% SDS-PAGE,N/A,N/A,N/A,SDS-PAGE
Recombinant Human Bad protein,Baculovirus infected Sf9 cells,>85% Densitometry,N/A,20 µg,US$ 360.00,"SDS-PAGE, WB"
Recombinant Human beta I Tubulin protein,Wheat germ,N/A,N/A,N/A,N/A,"ELISA, WB"
Recombinant human BAP1 protein (Active),Baculovirus infected Sf9 cells,>70% SDS-PAGE,N/A,N/A,N/A,"SDS-PAGE, FuncS"
Recombinant Human B4GALT5 protein,Wheat germ,N/A,N/A,N/A,N/A,"ELISA, WB"
Recombinant human CREBBP protein,Escherichia coli,>=96% SDS-PAGE,N/A,N/A,N/A,"SDS-PAGE, FuncS"
Recombinant human COX2 / Cyclooxygenase 2 protein,Baculovirus infected Sf9 cells,>90% SDS-PAGE,N/A,N/A,N/A,"SDS-PAGE, FuncS"
Recombinant human coronavirus SARS-CoV-2 3CL protease protein (Active),Escherichia coli,>90% SDS-PAGE,N/A,N/A,N/A,"SDS-PAGE, FuncS"
Recombinant human FGF9/GAF protein (Animal Free),Escherichia coli,>=95% SDS-PAGE,<= 1 EU/µg,25 µg,US$ 290.00,"SDS-PAGE, FuncS"
Recombinant human FGF1 protein (Animal Free),Escherichia coli,>95% SDS-PAGE,<= 1 EU/µg,10 µg,US$ 170.00,"SDS-PAGE, FuncS"
Recombinant human GLO1 protein,Escherichia coli,>90% SDS-PAGE,< 1 EU/µg,N/A,N/A,"SDS-PAGE, FuncS, MS"
Recombinant Human Collagen IV alpha 6 protein,Wheat germ,N/A,N/A,N/A,N/A,"ELISA, WB"
Recombinant Human FRMD3 protein,Wheat germ,N/A,N/A,N/A,N/A,"ELISA, WB"
Recombinant human KDM4C / GASC1 / JMJD2C protein (Tagged),Baculovirus infected Sf9 cells,>=82% SDS-PAGE,N/A,N/A,N/A,"SDS-PAGE, FuncS"
Recombinant Human KDM4C / GASC1 / JMJD2C protein,Baculovirus infected Sf9 cells,>95% Densitometry,N/A,N/A,N/A,"SDS-PAGE, WB"
Recombinant human KDM4B / JMJD2B protein,Baculovirus infected Sf9 cells,>=68% SDS-PAGE,N/A,N/A,N/A,"SDS-PAGE, FuncS"
Recombinant Human NFkB p100 / p52 protein,Baculovirus infected Sf9 cells,>75% Densitometry,N/A,20 µg,US$ 360.00,"SDS-PAGE, WB"
Recombinant human KAT2A / GCN5 protein,Baculovirus infected Sf9 cells,>=47% SDS-PAGE,N/A,N/A,N/A,"SDS-PAGE, FuncS"
Recombinant Human NLRP3 protein,Wheat germ,N/A,N/A,N/A,N/A,"ELISA, WB"
Recombinant Human NHE-6 protein,Wheat germ,N/A,N/A,N/A,N/A,"ELISA, WB"
Recombinant human RanBP2 protein (Active),Escherichia coli,>75% SDS-PAGE,N/A,N/A,N/A,"SDS-PAGE, FuncS"
